{
  "id": "titanium-6al-4v",
  "name": "Titanium Ti-6Al-4V (Grade 5)",
  "family": "metals",
  "short_name": "Ti-6Al-4V",
  "subfamily": "titanium-alloys",
  "applications": [
    "Jet engine components",
    "Airframe structure",
    "Biomedical implants",
    "Racing components"
  ],
  "notes": "Most widely used titanium alloy (~50% of all Ti production). Alpha-beta alloy. Annealed condition.",
  "properties": {
    "density_kg_m3": {
      "min": 4420,
      "max": 4440,
      "source": "ASM Handbook Vol 2"
    },
    "price_USD_kg": {
      "min": 30,
      "max": 60,
      "source": "ASM Handbook Vol 2"
    },
    "youngs_modulus_GPa": {
      "min": 113,
      "max": 120,
      "source": "ASM Handbook Vol 2"
    },
    "yield_strength_MPa": {
      "min": 880,
      "max": 1100,
      "source": "ASM Handbook Vol 2"
    },
    "ultimate_strength_MPa": {
      "min": 950,
      "max": 1170,
      "source": "ASM Handbook Vol 2"
    },
    "fracture_toughness_MPa_sqrt_m": {
      "min": 44,
      "max": 66,
      "source": "ASM Handbook Vol 2"
    },
    "elongation": {
      "min": 0.08,
      "max": 0.15,
      "source": "ASM Handbook Vol 2"
    },
    "melting_point_C": {
      "min": 1604,
      "max": 1660,
      "source": "ASM Handbook Vol 2"
    },
    "specific_heat_J_kgK": {
      "min": 520,
      "max": 530,
      "source": "ASM Handbook Vol 2"
    },
    "thermal_conductivity_W_mK": {
      "min": 6.7,
      "max": 7.3,
      "source": "ASM Handbook Vol 2"
    },
    "thermal_expansion_uK": {
      "min": 8.4,
      "max": 8.8,
      "source": "ASM Handbook Vol 2"
    },
    "electrical_resistivity_uohm_cm": {
      "min": 170,
      "max": 180,
      "source": "ASM Handbook Vol 2"
    },
    "embodied_energy_MJ_kg": {
      "min": 500,
      "max": 900,
      "source": "Bath ICE v3.0"
    },
    "co2_footprint_kg_kg": {
      "min": 36,
      "max": 55,
      "source": "Bath ICE v3.0"
    },
    "recycle_fraction": {
      "min": 0.35,
      "max": 0.5,
      "source": "Bath ICE v3.0"
    },
    "recycle_energy_MJ_kg": {
      "min": 40,
      "max": 80,
      "source": "Bath ICE v3.0"
    },
    "recycle_co2_kg_kg": {
      "min": 3.0,
      "max": 5.5,
      "source": "Bath ICE v3.0"
    }
  }
}