{
  "id": "butyl-rubber",
  "name": "Butyl rubber",
  "family": "elastomers",
  "short_name": "Butyl rubber",
  "applications": [
    "Inner tubes and tire liners",
    "Vibration mounts",
    "Chemical-resistant tubing"
  ],
  "properties": {
    "density_kg_m3": {
      "min": 900.0,
      "max": 920.0,
      "source": "Ashby App A (6th ed., 2025)"
    },
    "price_USD_kg": {
      "min": 2.3,
      "max": 2.3,
      "source": "Ashby App A (6th ed., 2025)"
    },
    "youngs_modulus_GPa": {
      "min": 0.001,
      "max": 0.002,
      "source": "Ashby App A (6th ed., 2025)"
    },
    "yield_strength_MPa": {
      "min": 2.0,
      "max": 3.0,
      "source": "Ashby App A (6th ed., 2025)"
    },
    "ultimate_strength_MPa": {
      "min": 5.0,
      "max": 10.0,
      "source": "Ashby App A (6th ed., 2025)"
    },
    "fracture_toughness_MPa_sqrt_m": {
      "min": 0.07,
      "max": 0.1,
      "source": "Ashby App A (6th ed., 2025)"
    },
    "glass_temperature_C": {
      "min": -73.0,
      "max": -63.0,
      "source": "Ashby App A (6th ed., 2025)"
    },
    "specific_heat_J_kgK": {
      "min": 1800.0,
      "max": 2500.0,
      "source": "Ashby App A (6th ed., 2025)"
    },
    "thermal_conductivity_W_mK": {
      "min": 0.08,
      "max": 0.1,
      "source": "Ashby App A (6th ed., 2025)"
    },
    "thermal_expansion_uK": {
      "min": 120.0,
      "max": 300.0,
      "source": "Ashby App A (6th ed., 2025)"
    },
    "embodied_energy_MJ_kg": {
      "min": 95.0,
      "max": 95.0,
      "source": "Ashby App A (6th ed., 2025)"
    },
    "co2_footprint_kg_kg": {
      "min": 4.4,
      "max": 4.4,
      "source": "Ashby App A (6th ed., 2025)"
    },
    "water_demand_L_kg": {
      "min": 110.0,
      "max": 110.0,
      "source": "Ashby App A (6th ed., 2025)"
    },
    "recycle_fraction": {
      "min": 0.028,
      "max": 0.028,
      "source": "Ashby App A (6th ed., 2025)"
    }
  }
}
