{
  "id": "hydroxyapatite",
  "name": "Hydroxyapatite (HA), dense sintered",
  "family": "ceramics-technical",
  "short_name": "Hydroxyapatite",
  "subfamily": "bioceramic",
  "applications": [
    "Bone scaffold implants",
    "Dental root fillings",
    "Orthopaedic coatings",
    "Drug delivery carriers"
  ],
  "notes": "Main mineral of bone. Bioactive, osteoconductive. Brittle \u2014 not for load-bearing alone.",
  "properties": {
    "density_kg_m3": {
      "min": 3100,
      "max": 3220,
      "source": "ASM Engineered Materials Handbook Vol 4"
    },
    "price_USD_kg": {
      "min": 100,
      "max": 500,
      "source": "ASM Engineered Materials Handbook Vol 4"
    },
    "youngs_modulus_GPa": {
      "min": 70,
      "max": 120,
      "source": "ASM Engineered Materials Handbook Vol 4"
    },
    "yield_strength_MPa": {
      "min": 40,
      "max": 200,
      "source": "ASM Engineered Materials Handbook Vol 4"
    },
    "fracture_toughness_MPa_sqrt_m": {
      "min": 0.6,
      "max": 1.3,
      "source": "ASM Engineered Materials Handbook Vol 4"
    },
    "melting_point_C": {
      "min": 1614,
      "max": 1614,
      "source": "ASM Engineered Materials Handbook Vol 4"
    },
    "specific_heat_J_kgK": {
      "min": 750,
      "max": 800,
      "source": "ASM Engineered Materials Handbook Vol 4"
    },
    "thermal_conductivity_W_mK": {
      "min": 1.2,
      "max": 2.3,
      "source": "ASM Engineered Materials Handbook Vol 4"
    },
    "thermal_expansion_uK": {
      "min": 11.0,
      "max": 14.0,
      "source": "ASM Engineered Materials Handbook Vol 4"
    }
  }
}