{
  "id": "silicon-carbide",
  "name": "Silicon carbide",
  "family": "ceramics-technical",
  "short_name": "SiC",
  "applications": [
    "High-temperature shaft seals",
    "Cutting and grinding abrasives",
    "Light armor plate"
  ],
  "properties": {
    "density_kg_m3": {
      "min": 3100.0,
      "max": 3200.0,
      "source": "Ashby App A (6th ed., 2025)"
    },
    "price_USD_kg": {
      "min": 16.0,
      "max": 16.0,
      "source": "Ashby App A (6th ed., 2025)"
    },
    "youngs_modulus_GPa": {
      "min": 400.0,
      "max": 460.0,
      "source": "Ashby App A (6th ed., 2025)"
    },
    "yield_strength_MPa": {
      "min": 400.0,
      "max": 610.0,
      "source": "Ashby App A (6th ed., 2025)"
    },
    "ultimate_strength_MPa": {
      "min": 400.0,
      "max": 610.0,
      "source": "Ashby App A (6th ed., 2025)"
    },
    "fracture_toughness_MPa_sqrt_m": {
      "min": 3.0,
      "max": 5.6,
      "source": "Ashby App A (6th ed., 2025)"
    },
    "melting_point_C": {
      "min": 2200.0,
      "max": 2500.0,
      "source": "Ashby App A (6th ed., 2025)"
    },
    "specific_heat_J_kgK": {
      "min": 660.0,
      "max": 800.0,
      "source": "Ashby App A (6th ed., 2025)"
    },
    "thermal_conductivity_W_mK": {
      "min": 80.0,
      "max": 130.0,
      "source": "Ashby App A (6th ed., 2025)"
    },
    "thermal_expansion_uK": {
      "min": 4.0,
      "max": 4.8,
      "source": "Ashby App A (6th ed., 2025)"
    },
    "dielectric_constant": {
      "min": 6.3,
      "max": 9.0,
      "source": "Ashby App A (6th ed., 2025)"
    },
    "embodied_energy_MJ_kg": {
      "min": 170.0,
      "max": 170.0,
      "source": "Ashby App A (6th ed., 2025)"
    },
    "co2_footprint_kg_kg": {
      "min": 7.2,
      "max": 7.2,
      "source": "Ashby App A (6th ed., 2025)"
    },
    "water_demand_L_kg": {
      "min": 58.0,
      "max": 58.0,
      "source": "Ashby App A (6th ed., 2025)"
    }
  }
}
