{
  "id": "flexible-foam-md",
  "name": "Flexible polymer foam (medium density)",
  "family": "foams",
  "short_name": "Flex foam MD",
  "applications": [
    "Upholstery foam",
    "Acoustic-damping pads",
    "Filtration sponges"
  ],
  "properties": {
    "density_kg_m3": {
      "min": 70.0,
      "max": 120.0,
      "source": "Ashby App A (6th ed., 2025)"
    },
    "price_USD_kg": {
      "min": 2.7,
      "max": 2.7,
      "source": "Ashby App A (6th ed., 2025)"
    },
    "youngs_modulus_GPa": {
      "min": 0.004,
      "max": 0.012,
      "source": "Ashby App A (6th ed., 2025)"
    },
    "yield_strength_MPa": {
      "min": 0.048,
      "max": 0.7,
      "source": "Ashby App A (6th ed., 2025)"
    },
    "ultimate_strength_MPa": {
      "min": 0.43,
      "max": 3.0,
      "source": "Ashby App A (6th ed., 2025)"
    },
    "fracture_toughness_MPa_sqrt_m": {
      "min": 0.03,
      "max": 0.09,
      "source": "Ashby App A (6th ed., 2025)"
    },
    "glass_temperature_C": {
      "min": -110.0,
      "max": -13.0,
      "source": "Ashby App A (6th ed., 2025)"
    },
    "specific_heat_J_kgK": {
      "min": 1800.0,
      "max": 2300.0,
      "source": "Ashby App A (6th ed., 2025)"
    },
    "thermal_conductivity_W_mK": {
      "min": 0.041,
      "max": 0.078,
      "source": "Ashby App A (6th ed., 2025)"
    },
    "thermal_expansion_uK": {
      "min": 120.0,
      "max": 220.0,
      "source": "Ashby App A (6th ed., 2025)"
    },
    "embodied_energy_MJ_kg": {
      "min": 90.0,
      "max": 90.0,
      "source": "Ashby App A (6th ed., 2025)"
    },
    "co2_footprint_kg_kg": {
      "min": 3.2,
      "max": 3.2,
      "source": "Ashby App A (6th ed., 2025)"
    },
    "water_demand_L_kg": {
      "min": 170.0,
      "max": 170.0,
      "source": "Ashby App A (6th ed., 2025)"
    }
  }
}
