{
  "id": "phenolic",
  "name": "Phenolics",
  "family": "polymers",
  "short_name": "Phenolic",
  "subfamily": "thermosets",
  "applications": [
    "Heat-resistant electrical fittings",
    "Press-molded handles",
    "Wood-product adhesives"
  ],
  "properties": {
    "density_kg_m3": {
      "min": 1200.0,
      "max": 1300.0,
      "source": "Ashby App A (6th ed., 2025)"
    },
    "price_USD_kg": {
      "min": 1.8,
      "max": 1.8,
      "source": "Ashby App A (6th ed., 2025)"
    },
    "youngs_modulus_GPa": {
      "min": 2.8,
      "max": 4.8,
      "source": "Ashby App A (6th ed., 2025)"
    },
    "yield_strength_MPa": {
      "min": 28.0,
      "max": 50.0,
      "source": "Ashby App A (6th ed., 2025)"
    },
    "ultimate_strength_MPa": {
      "min": 35.0,
      "max": 62.0,
      "source": "Ashby App A (6th ed., 2025)"
    },
    "fracture_toughness_MPa_sqrt_m": {
      "min": 0.79,
      "max": 1.2,
      "source": "Ashby App A (6th ed., 2025)"
    },
    "glass_temperature_C": {
      "min": 170.0,
      "max": 270.0,
      "source": "Ashby App A (6th ed., 2025)"
    },
    "specific_heat_J_kgK": {
      "min": 1500.0,
      "max": 1500.0,
      "source": "Ashby App A (6th ed., 2025)"
    },
    "thermal_conductivity_W_mK": {
      "min": 0.14,
      "max": 0.15,
      "source": "Ashby App A (6th ed., 2025)"
    },
    "thermal_expansion_uK": {
      "min": 120.0,
      "max": 120.0,
      "source": "Ashby App A (6th ed., 2025)"
    },
    "embodied_energy_MJ_kg": {
      "min": 77.0,
      "max": 77.0,
      "source": "Ashby App A (6th ed., 2025)"
    },
    "co2_footprint_kg_kg": {
      "min": 1.9,
      "max": 1.9,
      "source": "Ashby App A (6th ed., 2025)"
    },
    "water_demand_L_kg": {
      "min": 51.0,
      "max": 51.0,
      "source": "Ashby App A (6th ed., 2025)"
    },
    "recycle_fraction": {
      "min": 0.007,
      "max": 0.007,
      "source": "Ashby App A (6th ed., 2025)"
    }
  }
}
