{
  "id": "20351-inp",
  "name": "Indium phosphide (InP)",
  "family": "ceramics-technical",
  "short_name": "InP",
  "subfamily": "semiconductors",
  "applications": [
    "Fibre-optic laser diodes (1310/1550 nm)",
    "High-speed photonic ICs",
    "Solar cells",
    "THz devices"
  ],
  "notes": "Direct bandgap (1.34 eV). Substrate for InGaAsP and InGaAs devices \u2014 critical for optical communications.",
  "properties": {
    "density_kg_m3": {
      "min": 4611.0,
      "max": 4800.0,
      "source": "Materials Project mp-20351 (DFT)"
    },
    "youngs_modulus_GPa": {
      "min": 75.0,
      "max": 86.3,
      "source": "Materials Project mp-20351 (DFT, E = 9KG/(3K+G))"
    },
    "yield_strength_MPa": {
      "min": 60,
      "max": 100,
      "source": "ASM EH Vol 4"
    },
    "fracture_toughness_MPa_sqrt_m": {
      "min": 0.4,
      "max": 0.7,
      "source": "ASM EH Vol 4"
    },
    "melting_point_C": {
      "min": 1062,
      "max": 1062,
      "source": "CRC Handbook"
    },
    "specific_heat_J_kgK": {
      "min": 310,
      "max": 320,
      "source": "CRC Handbook"
    },
    "thermal_conductivity_W_mK": {
      "min": 68,
      "max": 72,
      "source": "CRC Handbook"
    },
    "thermal_expansion_uK": {
      "min": 4.5,
      "max": 4.8,
      "source": "CRC Handbook"
    },
    "embodied_energy_MJ_kg": {
      "min": 600,
      "max": 2000,
      "source": "Bath ICE v3.0 (estimate)"
    },
    "co2_footprint_kg_kg": {
      "min": 40,
      "max": 130,
      "source": "Bath ICE v3.0 (estimate)"
    }
  }
}